{
  "$schema": "../../packages/manifest/schema.json",
  "specVersion": 1,
  "slug": "pdfcraft",
  "name": "PdfCraft",
  "description": "PDFs lesen und bearbeiten im Browser: Seiten, Text, Anmerkungen und Formulare",
  "kind": "static",
  "target": "cloudflare",
  "access": {
    "default": true
  },
  "data": {
    "mode": "none"
  },
  "wasm": true,
  "build": {
    "command": "node build.mjs",
    "output": "dist"
  },
  "i18n": {
    "languages": ["de", "en"],
    "default": "de"
  }
}
