{
  "$schema": "../../packages/manifest/schema.json",
  "specVersion": 1,
  "slug": "wunschliste",
  "name": "Wunschliste",
  "description": "Eigene Wunschliste anlegen, bei anderen Geschenke reservieren, ohne Überraschungen zu verraten",
  "kind": "static",
  "target": "cloudflare",
  "access": { "default": true },
  "data": { "mode": "private" }
}
